rating,date,comment,raw_word_count,language,clean_comment,year_month,clean_word_count
5.0,2021-03-26,"An interesting take on real life problems. From prejudices and stereotypes to disabilities and acceptance. A fresh insight. It's a brilliant film for all ages. There's so much to reflect and learn from. Also, a great look at relationships and how people relate to one another. With lita of humour and goregous animation, Zootropolis is a definite classic.",58,en,interesting take real life problem prejudice stereotype disability acceptance fresh insight brilliant film age much reflect learn also great look relationship people relate one another lita humour goregous animation zootropolis definite classic,2021-03,32
5.0,2021-03-22,"Excellent movie, that touches social issues, 5 stars",8,en,excellent movie touch social issue star,2021-03,6
5.0,2021-03-10,Amazing! Kids will enjoy it and adults will reflect on the importance of tolerance and the wonders that diversity brings to the world,23,en,amazing kid enjoy adult reflect importance tolerance wonder diversity brings world,2021-03,11
5.0,2021-03-08,"""Zootopia"" is a smart, funny, and engaging film with a likable main character and a unique political angle",18,en,zootopia smart funny engaging film likable main character unique political angle,2021-03,11
5.0,2021-03-02,Funny and a amazing concept.,5,en,funny amazing concept,2021-03,3
5.0,2021-02-23,I really didn't want to watch this movie but my sister still managed to force me to... I'm glad she was so persistent!,23,en,really want watch movie sister still managed force glad persistent,2021-02,10
3.0,2021-02-03,"Watching this a few years after it came out and seeing all the accolades and warm reception it received makes it seem pretty clear that it was overrated upon release due to the political climate of early 2016. The story is indeed well-told and the animation is extremely good, far outstripping Moana from 8 months later, but the voice acting is only good, not great, there are no songs to be had and there's nothing to really latch onto as a favorite or memorable thing from the movie as they put a ton of effort into being well-rounded. There's a modicum of comedy, a dose of mystery and an underdog component but no facet of the movie is fantastic. I'm glad that I watched this as I'd heard of characters from the movie outside of it, but it's an otherwise-unmemorable police procedural with a rather plaudit-seeking morality angle.",148,en,watching year came seeing accolade warm reception received make seem pretty clear overrated upon release due political climate early story indeed well told animation extremely good far outstripping moana month later voice acting good great song nothing really latch onto favorite memorable thing movie put ton effort well rounded modicum comedy dose mystery underdog component facet movie fantastic glad watched heard character movie outside otherwise unmemorable police procedural rather plaudit seeking morality angle,2021-02,73
5.0,2021-01-26,A great animated movie,4,en,great animated movie,2021-01,3
4.0,2021-01-23,"A work of art produced by Disney that told the story of a young bunny who fought against all the odds to become a well respected police officer while unknowingly making a sly fox once a con artist into a best friend for life. In Zootopia there is no limits to what you can be, your biological species doesn't define your destiny. This made it even more enjoyable watching a struggling main character persevering through the hardship. It's nicely structured story coupled with hilarious scenes made the movie even more so enjoyable.",92,en,work art produced disney told story young bunny fought odds become well respected police officer unknowingly making sly fox con artist best friend life zootopia limit biological specie define destiny made even enjoyable watching struggling main character persevering hardship nicely structured story coupled hilarious scene made movie even enjoyable,2021-01,49
5.0,2021-01-03,Totally amazing!!! This Disney film was the BOMB over here! I LOVE IT!,13,en,totally amazing disney film bomb love,2021-01,6
4.5,2020-12-28,A great movie that is great,6,en,great movie great,2020-12,3
4.5,2020-12-18,This movie is great with amazing characters and their development. Kids and adults alike with really enjoy this film.,19,en,movie great amazing character development kid adult alike really enjoy film,2020-12,11
5.0,2020-12-16,It's a city with all sorts of animals. Sign me up!,11,en,city sort animal sign,2020-12,4
4.5,2020-12-11,"This movie was released at a perfect time when people are judging each other by what's on the outside instead of realizing that we are all the same. There are no undertones as it is thrown in our face but in a digestible way, even kids can understand. The main character Judy even has to let go of the prejudice that she has grown up with her entire life. it is really a beautiful movie to watch. The only reason that I am taking half a star off is because of the time period and how they chose to focus on her career as a cop. Cops are so glorified nowadays that we always see them as just individuals even though the system is corrupt. Besides that amazing movie!",129,en,movie released perfect time people judging outside instead realizing undertone thrown face digestible way even kid understand main character judy even let go prejudice grown entire life really beautiful movie watch reason taking half star time period chose focus career cop cop glorified nowadays always see individual even though system corrupt besides amazing movie,2020-12,54
4.0,2020-12-05,"Another fun, fast-paced Disney flick.",5,en,another fun fast paced disney flick,2020-12,6
5.0,2020-12-04,"The Best Film Of The Year, So Far. From the studio that brought you Tangled, Wreck-It Ralph, Frozen & Big Hero 6, Zootopia surfaces as a highly original, incredibly refreshing, thoroughly engaging, surprisingly timely & delightfully subversive beast fable about prejudice & stereotype that not only marks a new creative high for Disney but is arguably the finest film that this legendary animation studio has come up with in their Revival Era, so far. Set in a world inhabited by anthropomorphic animals, the story of Zootopia takes place in the titular metropolis and follows a bunny cop named Judy Hopps who, despite her par excellent performance in the class, is assigned parking duty by her superior. But when she volunteers to undertake a missing-predator case, she is given 48 hours to solve the mystery or resign, following which she blackmails a sly fox into helping her, and uncovers a sinister conspiracy. Co-directed by Byron Howard & Rich Moore, the duo put up an intriguing world on the screen that does have a fresh quality but there is still a deep sense of familiarity to it. However, where the two leave a lasting impression is in finding that perfect balance between its consistently gripping storyline & moments of pure hilarity. The writing staff also deserves a mention, for their screenplay brims with numerous pop culture references, parodies many renowned classics & handles its topical themes with care. The 3D animation is absolutely top-notch, for the images retain its crispness, clarity & vibrancy from beginning to end. The animators put up a vast number of characters on the screen, ranging from the largest elephant to the smallest shrew, yet they are all given a well-defined arc. Cinematography further enhances the overall look n feel of the story with its fluid camera-work, splendid use of colour palette & spot-on lighting. Editing provides just enough screen time to all the relevant characters while moving the plot forward at a blistering pace. The cast is wisely chosen, and all the actors do a competent job in lending their voice & soul to the mammals they play. Ginnifer Goodwin brings a bubbly side to the new cop in town and confidently plays her role. Jason Bateman plays his part with finesse plus his voice really fits his cynical con artist character. Also, the chemistry between the two is a highlight in itself. Michael Giacchino's ebullient score seamlessly blends in & compliments the narrative while Shakira beautifully wraps everything up with a catchy, uplifting & wonderful song that smartly summarises its themes & message. On an overall scale, Zootopia finds Disney stepping out of its comfort zone to tackle a bold, ambitious & risky project, and it is one gamble that pays off tremendously well in the studio's favour. Also, its arrival couldn't have been better, considering how its elements of prejudice & stereotypes mirror the racial hostilities present in our very own current social environment. An ingenious blend of sophisticated storytelling, jubilant humour & thought-provoking themes that amazes, entertains & enlightens without ever compromising with the fun factor, Zootopia is a definite delight for viewers of all ages, and is undoubtedly the best film of the year, so far. Strongly recommended.",535,en,best film year far studio brought tangled wreck ralph frozen big hero zootopia surface highly original incredibly refreshing thoroughly engaging surprisingly timely delightfully subversive beast fable prejudice stereotype mark new creative high disney arguably finest film legendary animation studio come revival era far set world inhabited anthropomorphic animal story zootopia take place titular metropolis follows bunny cop named judy hopps despite par excellent performance class assigned parking duty superior volunteer undertake missing predator case given hour solve mystery resign following blackmail sly fox helping uncovers sinister conspiracy co directed byron howard rich moore duo put intriguing world screen fresh quality still deep sense familiarity however two leave lasting impression finding perfect balance consistently gripping storyline moment pure hilarity writing staff also deserves mention screenplay brim numerous pop culture reference parody many renowned classic handle topical theme care animation absolutely top notch image retain crispness clarity vibrancy beginning end animator put vast number character screen ranging largest elephant smallest shrew yet given well defined arc cinematography enhances overall look n feel story fluid camera work splendid use colour palette spot lighting editing provides enough screen time relevant character moving plot forward blistering pace cast wisely chosen actor competent job lending voice soul mammal play ginnifer goodwin brings bubbly side new cop town confidently play role jason bateman play part finesse plus voice really fit cynical con artist character also chemistry two highlight michael giacchino ebullient score seamlessly blend compliment narrative shakira beautifully wrap everything catchy uplifting wonderful song smartly summarises theme message overall scale zootopia find disney stepping comfort zone tackle bold ambitious risky project one gamble pay tremendously well studio favour also arrival better considering element prejudice stereotype mirror racial hostility present current social environment ingenious blend sophisticated storytelling jubilant humour thought provoking theme amazes entertains enlightens without ever compromising fun factor zootopia definite delight viewer age undoubtedly best film year far strongly recommended,2020-12,314
5.0,2020-11-27,One of my favorite Disney films of all time great movie,11,en,one favorite disney film time great movie,2020-11,7
5.0,2020-11-23,"Emotionally compelling, amazing messages, and great characters. Zootopia is one the most mature films in animated movies to date. Not to mention how funny it is.",26,en,emotionally compelling amazing message great character zootopia one mature film animated movie date mention funny,2020-11,15
5.0,2020-11-17,"I think zootopia is a really good movie, and I would recommend it to people who like animals or animations(or both). is about a rabbit named Judy who wants to be the first rabbit police. She is disappointed because her boss makes her do parking duty. Then, she suddenly becomes in charge of the missing mammals case. With a fox named Nick, she starts to find the mammals...(no spoilers) My favorite part of the movie was the part where Judy started doing parking duty. Seeing her trying hard even though it wasn't what she expected looked good, and inspired me to do the same. My LEAST favorite part was...nothing.",109,en,think zootopia really good movie would recommend people like animal animation rabbit named judy want first rabbit police disappointed bos make parking duty suddenly becomes charge missing mammal case fox named nick start find mammal spoiler favorite part movie part judy started parking duty seeing trying hard even though expected looked good inspired least favorite part nothing,2020-11,57
5.0,2020-11-14,"I love the movie! very hilarious, adventures, and mysteries.",9,en,love movie hilarious adventure mystery,2020-11,5
4.5,2020-11-01,"Such a clever, deep and touching movie. It blew my mind.",11,en,clever deep touching movie blew mind,2020-11,6
5.0,2020-10-30,Love this movie! And it's timely social messages.,8,en,love movie timely social message,2020-10,5
5.0,2020-10-22,"A ""kids"" movie that actually has a good plot, great jokes & likeable, surprisingly realistic characters.",16,en,kid movie actually good plot great joke likeable surprisingly realistic character,2020-10,11
4.5,2020-10-21,"Zootopia is one of Disney's better films in recent times. The story is mostly about careers and race/stereotyping, but it had a unique spin and contained important messages. It didn't feel like a politically motivated plot; it was more of an introduction to the difficulties of life as you grow up. The pacing was good, the main characters were solid, the voice acting was fantastic, there was some good humour, and there were various entertaining references to other films like The Godfather. However, the villain was another twist villain just like in Big Hero 6 - Disney seems to love twist villains now, even though they don't work well. The villain was probably the biggest weakness of the film. The animation was beautiful as always, and the music fit well. It's a shame Disney is now more invested in ruining their original stories with live action remakes rather than making more films like this.",154,en,zootopia one disney better film recent time story mostly career race stereotyping unique spin contained important message feel like politically motivated plot introduction difficulty life grow pacing good main character solid voice acting fantastic good humour various entertaining reference film like godfather however villain another twist villain like big hero disney seems love twist villain even though work well villain probably biggest weakness film animation beautiful always music fit well shame disney invested ruining original story live action remake rather making film like,2020-10,83
5.0,2020-10-16,"this animation is visually beautiful, has a great script and very good and a little funny characters.",17,en,animation visually beautiful great script good little funny character,2020-10,9
5.0,2020-10-13,I don't think I've seen an animated film that tackled heavy themes about prejudice and hate better than or as uniquely as Zootopia. Its vibrant and colorful animation bring to life this world used to present clever allegories for racism and sexism.,42,en,think seen animated film tackled heavy theme prejudice hate better uniquely zootopia vibrant colorful animation bring life world used present clever allegory racism sexism,2020-10,24
3.0,2020-10-10,Good animation. Tired and overdone story of racial/cultural acceptance - not deep in the slightest. The cameos are barely there. The preview wrapped up the only scene that makes the movie memorable.,32,en,good animation tired overdone story racial cultural acceptance deep slightest cameo barely preview wrapped scene make movie memorable,2020-10,18
5.0,2020-09-25,"This by far is in my top three Disney animated movies of all time. This film is not just in an original idea having animals live in our world by their own means, but it also talks about important modern day problems such as racism, sexuality and much much more. It also ends up being a buddy cop film, Where a fox and a rabbit are hunting down some of Zootopia’s warrants. Everything in this film is perfect as far as I’m concerned the visuals, the score, the voice acting etc. I went into this film with mediocre expectations and I heard nothing but amazing things before I saw it in theaters and even going in with decent expectations my mind is still blown even after my fifth rewatch. This is one of those movies that is clearly just pure Disney magic.",142,en,far top three disney animated movie time film original idea animal live world mean also talk important modern day problem racism sexuality much much also end buddy cop film fox rabbit hunting zootopia warrant everything film perfect far concerned visuals score voice acting etc went film mediocre expectation heard nothing amazing thing saw theater even going decent expectation mind still blown even fifth rewatch one movie clearly pure disney magic,2020-09,70
5.0,2020-09-16,This movie is so exciting and one of disney's best.,10,en,movie exciting one disney best,2020-09,5
4.0,2020-09-12,"Zootopia has some flaws, the first is the villain. Its stops the story and appears only for 5 minutes. The pointless Action scene at the end, the stiff way to hammer down fox's backstory and some of the characters (other than the villain) has not much of a moment to shine and a full impacts while also not having any likeable personalities. On the other hand, this film is great by not hammering down the massage, some clever scenes at times and some likable characters (especially the main once). I do have one criticism with the animation, the places gets reused and repeatetive. Story 8/10 Animation 9/10 Characters 8/10 8/10",110,en,zootopia flaw first villain stop story appears minute pointless action scene end stiff way hammer fox backstory character villain much moment shine full impact also likeable personality hand film great hammering massage clever scene time likable character especially main one criticism animation place get reused repeatetive story animation character,2020-09,49
4.5,2020-09-09,This is an exceptional animated film that handles ideas like racial bias and stereotyping in a way that teaches moral lessons accessible to all members of a family for every generation from children to parents to grandparents regardless of their level of life experience.,44,en,exceptional animated film handle idea like racial bias stereotyping way teach moral lesson accessible member family every generation child parent grandparent regardless level life experience,2020-09,25
5.0,2020-09-09,"A powerful film that can serve as a great introduction to a complicated little thing called ""real life"" to kids.",20,en,powerful film serve great introduction complicated little thing called real life kid,2020-09,12
3.5,2020-09-06,"I like 'Zootopia', it's much better than I had anticipated. First off, the animation is superb - as we expect from Disney of course, but that doesn't change the fact. Ginnifer Goodwin (Judy) leads the cast very well, while Jason Bateman gives the most memorable performance as Nick. Idris Elba and Jenny Slate (not Edie Falco or Constance Shulman, as I initially guessed... just me? Probably) are good too. The premise is actually my favourite part of this film. I'm not saying it's anything revolutionary, but it actually feels fresh throughout - I enjoyed seeing it play out, it's paced perfectly. There's a nice 'Breaking Bad' reference in there, too. An entertaining 2016 animated film, one that also has a positive message. Recommended.",123,en,like zootopia much better anticipated first animation superb expect disney course change fact ginnifer goodwin judy lead cast well jason bateman give memorable performance nick idris elba jenny slate edie falco constance shulman initially guessed probably good premise actually favourite part film saying anything revolutionary actually feel fresh throughout enjoyed seeing play paced perfectly nice breaking bad reference entertaining animated film one also positive message recommended,2020-09,66
5.0,2020-09-01,"This is one of my favorite animated films of the last 10 years, and for so many reasons! It feels fresh and different story wise, and there are plenty of excellent characters. Jason Bateman's star shines brightly with some solid voice acting, but does not overwhelm a sky full of memorable characters. Judy Hopps, played by Ginnifer Goodwin is wonderful and perfect, and also my new crush. She is sweet and naive, but grows exponentially as she attempts to overcome her perceived limitations as a police officer who is small in stature, but with enough resourcefulness and heart to overcome any situation. Zootopia is infinitely rewatchable, and I plan to keep this on standby for those rainy days when I don't need to think, but I just need to laugh and have fun.",133,en,one favorite animated film last year many reason feel fresh different story wise plenty excellent character jason bateman star shine brightly solid voice acting overwhelm sky full memorable character judy hopps played ginnifer goodwin wonderful perfect also new crush sweet naive grows exponentially attempt overcome perceived limitation police officer small stature enough resourcefulness heart overcome situation zootopia infinitely rewatchable plan keep standby rainy day need think need laugh fun,2020-09,69
5.0,2020-08-13,Zootopia manages to be a critic of society with a lot of fun and a great universe.,17,en,zootopia manages critic society lot fun great universe,2020-08,8
5.0,2020-08-07,"Zootopia is one of my favorite animated movie and it has some comedy in it but lots of heartwarming drama made by Pixar with animals. Bonnie Hunt, Jason Bateman, Ginifer Goodwin, Shakira, Jenny Slate, Kristen Bell, John DiMaggio and J.K Simmons.10/10",41,en,zootopia one favorite animated movie comedy lot heartwarming drama made pixar animal bonnie hunt jason bateman ginifer goodwin shakira jenny slate kristen bell john dimaggio j k simmons,2020-08,28
5.0,2020-08-03,"A visually stunning, brilliantly animated and thoughtful Disney animation that deals with heavy themes like racism and political bigotry, has endearing characters and a thought-provoking, emotional, intelligent and entertaining narrative.",30,en,visually stunning brilliantly animated thoughtful disney animation deal heavy theme like racism political bigotry endearing character thought provoking emotional intelligent entertaining narrative,2020-08,22
5.0,2020-08-01,Zootopia is the greatest Oscar-Winning Disney animated feature film I ever loved.,12,en,zootopia greatest oscar winning disney animated feature film ever loved,2020-08,10
5.0,2020-07-28,Heat movie. Fun for all of us!,7,en,heat movie fun u,2020-07,4
5.0,2020-07-24,"One of the best animated films of the past decade. The animation is beautiful, the voice acting is great, the creativity is off the charts, and the message is needed.",30,en,one best animated film past decade animation beautiful voice acting great creativity chart message needed,2020-07,15
4.0,2020-07-12,"this movie is full of real world experiences in the form of children's animation. i think everyone can relate to a character in this movie. the one big problem i have with the movie is the villain. she seems very underdeveloped. and although it was unexpected, i personally think it was because she didn't have any villainous qualities until it was revealed. she is very similar to hans from frozen and in that they don't seem at all like villains until they are revealed as ones. i think if they would've developed her more this movie could've been very memorable and extraordinary, but personally it fell a little short.",109,en,movie full real world experience form child animation think everyone relate character movie one big problem movie villain seems underdeveloped although unexpected personally think villainous quality revealed similar han frozen seem like villain revealed one think would developed movie could memorable extraordinary personally fell little short,2020-07,46
